{
  "document_type": "appointment_denial",
  "hospital_name": "Hospital Nacional Guillermo Almenara Irigoyen",
  "hospital_network": "EsSalud",
  "patient_name": "ABNER RIVERA QUISPE",
  "patient_dni": "45678901",
  "date_of_document": "2026-04-15",
  "date_of_attempted_care": "2026-04-20",
  "specialty_requested": "TRAUMATOLOGÍA",
  "reason_given": "SIN CUPO DISPONIBLE",
  "reason_given_translated_plain_spanish": "No hay espacios disponibles para esa fecha.",
  "raw_text_extracted": "ESSALUD HOSPITAL ALMENARA\nCONSTANCIA DE CITA DENEGADA\nPaciente: ABNER RIVERA QUISPE DNI: 45678901\nFecha: 15/04/2026\nEspecialidad: TRAUMATOLOGÍA\nMotivo: SIN CUPO DISPONIBLE",
  "confidence": 0.92,
  "warnings": []
}
